{
  "site": "https://codeforces.com/",
  "audited_at": "2026-09-11T19:03:43.637711+00:00",
  "agent": "marketplace",
  "marketplace": {
    "id": "ai-discoverability-engagement-marketplace",
    "name": "AI Discoverability & Engagement Audit Marketplace",
    "version": "1.0.0",
    "entrypoint": "audit-orchestrator",
    "skills_invoked": [
      "crawl-render-audit",
      "content-semantics-audit",
      "entity-freshness-audit",
      "engagement-audit"
    ],
    "read_only": true
  },
  "summary": {
    "total_findings": 1,
    "critical": 0,
    "high": 0,
    "medium": 1,
    "low": 0,
    "by_severity": {
      "critical": 0,
      "high": 0,
      "medium": 1,
      "low": 0
    },
    "categories_flagged": [
      "structured_data"
    ],
    "categories_clean": [
      "content_extraction",
      "corroboration",
      "crawlability",
      "engagement",
      "entity_identity",
      "freshness",
      "non_text_facts",
      "rendering"
    ],
    "health_score": 89,
    "top_priority": "No machine-readable structured data (JSON-LD, microdata or RDFa) anywhere on the site",
    "pages_crawled": 12,
    "pages_retrievable": 10,
    "recommendation_count": 8,
    "runtime_seconds": 28.359
  },
  "findings": [
    {
      "id": "MKT-SCHEMA-01",
      "title": "No machine-readable structured data (JSON-LD, microdata or RDFa) anywhere on the site",
      "category": "structured_data",
      "_category": "structured_data",
      "severity": "medium",
      "confidence": "high",
      "evidence": "0 of 10 crawled pages expose structured data: https://codeforces.com/ (HTTP 200) serves 21101 characters (3098 words) of organisation, product and contact information in prose but contains 0 application/ld+json blocks and 0 itemtype/typeof attributes.",
      "locations": [
        "https://codeforces.com/"
      ],
      "proof": {
        "pages_checked": 10,
        "pages_with_schema": 0
      },
      "suggested_action": {
        "summary": "Add an Organization JSON-LD block in the HTML <head> of every page (name, url, logo, description, address, contactPoint, sameAs) and Product/Offer JSON-LD next to each product section, so the facts that are currently prose-only become machine-readable and AI systems can extract and cite them as attributed entity data instead of inferring them from the copy.",
        "priority": "medium",
        "mechanism": "Schema.org markup is the one channel where a site states its own facts unambiguously; without it every extraction is an inference that an assistant may decline to cite."
      },
      "detected_by": "content-semantics-audit",
      "rank": 1
    }
  ],
  "recommendations": [
    {
      "title": "Add Product structured data for individual products after the Organization block",
      "detail": "Once Organization JSON-LD exists, model each individual product with Product and an Offer (price, priceCurrency, availability). That is what lets an assistant quote your pricing per product with attribution instead of paraphrasing a page.",
      "category": "structured_data",
      "effort": "medium"
    },
    {
      "title": "Publish an XML sitemap with lastmod dates",
      "detail": "No /sitemap.xml was served. A sitemap with accurate <lastmod> values gives crawlers a cheap freshness signal and a complete URL inventory, which improves how quickly new facts are picked up.",
      "category": "crawlability",
      "effort": "low"
    },
    {
      "title": "Add FAQPage structured data for the questions buyers ask",
      "detail": "FAQ structured data turns copy you already have into exact question/answer pairs that AI answers can lift verbatim, and it is the cheapest schema to add after Organization and Product.",
      "category": "structured_data",
      "effort": "low"
    },
    {
      "title": "Use one spelling of the company name in every identity slot",
      "detail": "Two closely related spellings were observed (\"Codeforces\" and \"Merhaba Codeforces!\", 74% similar). This is not yet ambiguous, but standardising the shorter form as `alternateName` in Organization JSON-LD keeps entity resolution unambiguous as the site grows.",
      "category": "entity_identity",
      "effort": "low"
    },
    {
      "title": "Declare external profiles in `sameAs` as well as in the footer",
      "detail": "The site links out to 4 identity platforms but publishes no `sameAs` array in its Organization schema. Putting the same URLs in `sameAs` states the link machine-readably instead of leaving it to be inferred from anchor tags.",
      "category": "corroboration",
      "effort": "low"
    },
    {
      "title": "Add breadcrumb navigation with BreadcrumbList markup",
      "detail": "No breadcrumbs were found. Breadcrumbs give a visitor arriving from an AI citation immediate context about where they are, and give crawlers an explicit hierarchy for the site.",
      "category": "engagement",
      "effort": "low"
    },
    {
      "title": "Add a site-wide footer with secondary navigation",
      "detail": "No <footer> landmark was found. A footer carrying company identity, contact details and links to policy pages is a low-effort orientation anchor that also strengthens internal linking.",
      "category": "engagement",
      "effort": "low"
    },
    {
      "title": "Make internal anchor text descriptive",
      "detail": "2 internal links use generic anchor text (e.g. \"here\"). Descriptive anchors such as 'AcmeKube pricing' tell both readers and models what the destination covers. This is a refinement, not a defect: the links themselves work.",
      "category": "engagement",
      "effort": "low"
    }
  ],
  "coverage": {
    "crawlability": "clean",
    "rendering": "clean",
    "content_extraction": "clean",
    "structured_data": "flagged",
    "non_text_facts": "clean",
    "freshness": "clean",
    "entity_identity": "clean",
    "corroboration": "clean",
    "engagement": "clean"
  },
  "checks_performed": [
    {
      "skill": "crawl-render-audit",
      "check": "entry_url_retrievable",
      "passed": true
    },
    {
      "skill": "crawl-render-audit",
      "check": "robots_allows_ai_agents",
      "passed": true
    },
    {
      "skill": "crawl-render-audit",
      "check": "content_present_without_javascript",
      "passed": true
    },
    {
      "skill": "crawl-render-audit",
      "check": "pages_crawled",
      "value": 12,
      "value_ok": 10
    },
    {
      "skill": "content-semantics-audit",
      "check": "structured_data_present",
      "passed": false
    },
    {
      "skill": "content-semantics-audit",
      "check": "facts_extractable_as_text",
      "passed": true,
      "value": 4
    },
    {
      "skill": "content-semantics-audit",
      "check": "no_image_only_facts",
      "passed": true
    },
    {
      "skill": "content-semantics-audit",
      "check": "fact_families_covered",
      "value": {
        "pricing": true,
        "contact": true,
        "company_facts": true,
        "product_detail": true
      }
    },
    {
      "skill": "entity-freshness-audit",
      "check": "single_canonical_entity_name",
      "passed": true,
      "value": 2,
      "canonical": "codeforces"
    },
    {
      "skill": "entity-freshness-audit",
      "check": "content_is_current",
      "passed": true,
      "value": 207
    },
    {
      "skill": "entity-freshness-audit",
      "check": "externally_corroborated",
      "passed": true,
      "value": 4
    },
    {
      "skill": "engagement-audit",
      "check": "navigation_landmarks_present",
      "passed": true,
      "value": 0
    },
    {
      "skill": "engagement-audit",
      "check": "internal_links_present",
      "value": 263
    },
    {
      "skill": "engagement-audit",
      "check": "breadcrumbs_present",
      "value": false
    }
  ],
  "telemetry": {
    "skills": [
      {
        "skill": "crawl-render-audit",
        "version": "1.0.0",
        "status": "ok",
        "error": null,
        "findings": 0,
        "recommendations": 1,
        "runtime_seconds": 19.11,
        "provides": [
          "crawlability",
          "rendering"
        ]
      },
      {
        "skill": "content-semantics-audit",
        "version": "1.0.0",
        "status": "ok",
        "error": null,
        "findings": 1,
        "recommendations": 2,
        "runtime_seconds": 8.344,
        "provides": [
          "content_extraction",
          "structured_data",
          "non_text_facts"
        ]
      },
      {
        "skill": "entity-freshness-audit",
        "version": "1.0.0",
        "status": "ok",
        "error": null,
        "findings": 0,
        "recommendations": 2,
        "runtime_seconds": 0.359,
        "provides": [
          "entity_identity",
          "freshness",
          "corroboration"
        ]
      },
      {
        "skill": "engagement-audit",
        "version": "1.0.0",
        "status": "ok",
        "error": null,
        "findings": 0,
        "recommendations": 3,
        "runtime_seconds": 0.406,
        "provides": [
          "engagement"
        ]
      }
    ],
    "runtime_seconds": 28.359,
    "pages_fetched": 12,
    "broken_links": [
      {
        "url": "https://codeforces.com/enter?back=%2F",
        "status": 403
      },
      {
        "url": "https://codeforces.com/register",
        "status": 403
      }
    ]
  }
}