{
  "site": "https://www.meesho.com/",
  "audited_at": "2026-09-12T18:59:21.380530+00:00",
  "agent": "marketplace",
  "marketplace": {
    "id": "ai-discoverability-engagement-marketplace",
    "name": "AI Discoverability & Engagement Audit Marketplace",
    "version": "1.0.0",
    "entrypoint": "audit-orchestrator",
    "skills_invoked": [
      "crawl-render-audit",
      "content-semantics-audit",
      "entity-freshness-audit",
      "engagement-audit"
    ],
    "read_only": true
  },
  "summary": {
    "total_findings": 1,
    "critical": 1,
    "high": 0,
    "medium": 0,
    "low": 0,
    "by_severity": {
      "critical": 1,
      "high": 0,
      "medium": 0,
      "low": 0
    },
    "categories_flagged": [
      "crawlability"
    ],
    "categories_clean": [
      "content_extraction",
      "corroboration",
      "engagement",
      "entity_identity",
      "freshness",
      "non_text_facts",
      "rendering",
      "structured_data"
    ],
    "health_score": 66,
    "top_priority": "Entry URL is not retrievable by a plain HTTP client",
    "pages_crawled": 1,
    "pages_retrievable": 0,
    "recommendation_count": 1,
    "runtime_seconds": 1.625
  },
  "findings": [
    {
      "id": "MKT-CRAWL-01",
      "title": "Entry URL is not retrievable by a plain HTTP client",
      "category": "crawlability",
      "_category": "crawlability",
      "severity": "critical",
      "confidence": "high",
      "evidence": "GET https://www.meesho.com/ returned HTTP 403 (no HTML body returned); 0 pages of HTML were retrievable across 1 requested page. An AI crawler cannot index what it cannot fetch.",
      "locations": [
        "https://www.meesho.com/"
      ],
      "proof": {
        "status_code": 403,
        "transport_error": false,
        "retried": true
      },
      "suggested_action": {
        "summary": "Return HTTP 200 with a server-rendered HTML body for the canonical entry URL, and exempt AI crawler user agents from any WAF or bot rule that answers 4xx, so the page becomes machine-readable and assistants can discover, extract and cite it at all. If this audit ran behind a proxy, re-run it from a network that can reach the host before acting on this finding.",
        "priority": "critical",
        "mechanism": "Retrieval is the first stage of every AI answer pipeline; a non-200 entry URL removes the site from the candidate set entirely."
      },
      "detected_by": "crawl-render-audit",
      "rank": 1
    }
  ],
  "recommendations": [
    {
      "title": "Add `sameAs` links to social profiles in Organization JSON-LD",
      "detail": "Even if your site is otherwise healthy, adding `sameAs` links to your LinkedIn, Crunchbase, and Twitter profiles inside your Organization JSON-LD explicitly binds those distinct sources together into one entity graph. AI assistants heavily rely on this to merge facts from different domains into a single confident answer.",
      "category": "entity_identity",
      "effort": "low"
    }
  ],
  "coverage": {
    "crawlability": "flagged",
    "rendering": "clean",
    "content_extraction": "clean",
    "structured_data": "clean",
    "non_text_facts": "clean",
    "freshness": "clean",
    "entity_identity": "clean",
    "corroboration": "clean",
    "engagement": "clean"
  },
  "checks_performed": [
    {
      "skill": "crawl-render-audit",
      "check": "entry_url_retrievable",
      "passed": false
    },
    {
      "skill": "crawl-render-audit",
      "check": "robots_allows_ai_agents",
      "passed": false
    },
    {
      "skill": "crawl-render-audit",
      "check": "content_present_without_javascript",
      "passed": true
    },
    {
      "skill": "crawl-render-audit",
      "check": "pages_crawled",
      "value": 1,
      "value_ok": 0
    }
  ],
  "telemetry": {
    "skills": [
      {
        "skill": "crawl-render-audit",
        "version": "1.0.0",
        "status": "ok",
        "error": null,
        "findings": 1,
        "recommendations": 0,
        "runtime_seconds": 1.547,
        "provides": [
          "crawlability",
          "rendering"
        ]
      },
      {
        "skill": "content-semantics-audit",
        "version": "1.0.0",
        "status": "error",
        "error": "no retrievable pages in snapshot",
        "findings": 0,
        "recommendations": 0,
        "runtime_seconds": 0.0,
        "provides": [
          "content_extraction",
          "structured_data",
          "non_text_facts"
        ]
      },
      {
        "skill": "entity-freshness-audit",
        "version": "1.0.0",
        "status": "error",
        "error": "no retrievable pages in snapshot",
        "findings": 0,
        "recommendations": 0,
        "runtime_seconds": 0.0,
        "provides": [
          "entity_identity",
          "freshness",
          "corroboration"
        ]
      },
      {
        "skill": "engagement-audit",
        "version": "1.0.0",
        "status": "error",
        "error": "no retrievable pages in snapshot",
        "findings": 0,
        "recommendations": 0,
        "runtime_seconds": 0.0,
        "provides": [
          "engagement"
        ]
      }
    ],
    "runtime_seconds": 1.625,
    "pages_fetched": 1,
    "broken_links": [
      {
        "url": "https://www.meesho.com/",
        "status": 403
      }
    ]
  }
}