{
  "site": "https://www.google.com/",
  "audited_at": "2026-09-12T11:33:58.979811+00:00",
  "agent": "marketplace",
  "marketplace": {
    "id": "ai-discoverability-engagement-marketplace",
    "name": "AI Discoverability & Engagement Audit Marketplace",
    "version": "1.0.0",
    "entrypoint": "audit-orchestrator",
    "skills_invoked": [
      "crawl-render-audit",
      "content-semantics-audit",
      "entity-freshness-audit",
      "engagement-audit"
    ],
    "read_only": true
  },
  "summary": {
    "total_findings": 0,
    "critical": 0,
    "high": 0,
    "medium": 0,
    "low": 0,
    "by_severity": {
      "critical": 0,
      "high": 0,
      "medium": 0,
      "low": 0
    },
    "categories_flagged": [],
    "categories_clean": [
      "content_extraction",
      "crawlability",
      "engagement",
      "entity_identity",
      "freshness",
      "non_text_facts",
      "rendering",
      "structured_data"
    ],
    "health_score": 100,
    "top_priority": "No AI-discoverability defects detected",
    "pages_crawled": 12,
    "pages_retrievable": 12,
    "recommendation_count": 8,
    "runtime_seconds": 11.054
  },
  "findings": [],
  "recommendations": [
    {
      "title": "Extend structured data to Product/Offer nodes",
      "detail": "Organization schema is present but individual products and prices are not modelled. Adding Product with an Offer (price, priceCurrency, availability) lets assistants quote your pricing with attribution instead of paraphrasing a table.",
      "category": "structured_data",
      "effort": "medium"
    },
    {
      "title": "Give every page an explicit next step",
      "detail": "No contact, demo or pricing call-to-action was detected in the body copy. A single clear next step converts the attention that an AI citation sends to the page.",
      "category": "engagement",
      "effort": "medium"
    },
    {
      "title": "Publish an XML sitemap with lastmod dates",
      "detail": "No /sitemap.xml was served. A sitemap with accurate <lastmod> values gives crawlers a cheap freshness signal and a complete URL inventory, which improves how quickly new facts are picked up.",
      "category": "crawlability",
      "effort": "low"
    },
    {
      "title": "Add Organization schema alongside the existing structured data",
      "detail": "Structured data is present (WebPage) but no Organization/LocalBusiness node was found. Organization markup is what ties products, reviews and articles to a single citable entity.",
      "category": "structured_data",
      "effort": "low"
    },
    {
      "title": "Validate structured data in CI so a syntax error cannot ship",
      "detail": "The site already relies on JSON-LD, so a single malformed block silently removes every machine-readable fact on that page. Add a schema validation step to the build (a JSON parse plus a schema.org type check) to keep the markup trustworthy.",
      "category": "structured_data",
      "effort": "low"
    },
    {
      "title": "Add FAQPage schema for the questions buyers actually ask",
      "detail": "FAQ structured data is the cheapest way to get exact question/answer pairs into AI answers, and it reuses copy you already have on product and support pages.",
      "category": "structured_data",
      "effort": "low"
    },
    {
      "title": "Add breadcrumb navigation with BreadcrumbList markup",
      "detail": "No breadcrumbs were found. Breadcrumbs give a visitor arriving from an AI citation immediate context about where they are, and give crawlers an explicit hierarchy for the site.",
      "category": "engagement",
      "effort": "low"
    },
    {
      "title": "Add a site-wide footer with secondary navigation",
      "detail": "No <footer> landmark was found. A footer carrying company identity, contact details and links to policy pages is a low-effort orientation anchor that also strengthens internal linking.",
      "category": "engagement",
      "effort": "low"
    }
  ],
  "coverage": {
    "crawlability": "clean",
    "rendering": "clean",
    "content_extraction": "clean",
    "structured_data": "clean",
    "non_text_facts": "clean",
    "freshness": "clean",
    "entity_identity": "clean",
    "engagement": "clean"
  },
  "checks_performed": [
    {
      "skill": "crawl-render-audit",
      "check": "entry_url_retrievable",
      "passed": true
    },
    {
      "skill": "crawl-render-audit",
      "check": "robots_allows_ai_agents",
      "passed": true
    },
    {
      "skill": "crawl-render-audit",
      "check": "content_present_without_javascript",
      "passed": true
    },
    {
      "skill": "crawl-render-audit",
      "check": "pages_crawled",
      "value": 12,
      "value_ok": 12
    },
    {
      "skill": "content-semantics-audit",
      "check": "structured_data_present",
      "passed": true
    },
    {
      "skill": "content-semantics-audit",
      "check": "facts_extractable_as_text",
      "passed": true,
      "value": 0
    },
    {
      "skill": "content-semantics-audit",
      "check": "no_image_only_facts",
      "passed": true
    },
    {
      "skill": "content-semantics-audit",
      "check": "fact_families_covered",
      "value": {
        "pricing": false,
        "contact": false,
        "company_facts": false,
        "product_detail": false
      }
    },
    {
      "skill": "entity-freshness-audit",
      "check": "single_canonical_entity_name",
      "passed": true,
      "value": 1,
      "canonical": "google"
    },
    {
      "skill": "entity-freshness-audit",
      "check": "content_is_current",
      "passed": true,
      "value": 2
    },
    {
      "skill": "entity-freshness-audit",
      "check": "externally_corroborated",
      "passed": true,
      "value": 0
    },
    {
      "skill": "engagement-audit",
      "check": "navigation_landmarks_present",
      "passed": true,
      "value": 0
    },
    {
      "skill": "engagement-audit",
      "check": "internal_links_present",
      "value": 16
    },
    {
      "skill": "engagement-audit",
      "check": "breadcrumbs_present",
      "value": false
    }
  ],
  "telemetry": {
    "skills": [
      {
        "skill": "crawl-render-audit",
        "version": "1.0.0",
        "status": "ok",
        "error": null,
        "findings": 0,
        "recommendations": 1,
        "runtime_seconds": 10.992,
        "provides": [
          "crawlability",
          "rendering"
        ]
      },
      {
        "skill": "content-semantics-audit",
        "version": "1.0.0",
        "status": "ok",
        "error": null,
        "findings": 0,
        "recommendations": 4,
        "runtime_seconds": 0.006,
        "provides": [
          "content_extraction",
          "structured_data",
          "non_text_facts"
        ]
      },
      {
        "skill": "entity-freshness-audit",
        "version": "1.0.0",
        "status": "ok",
        "error": null,
        "findings": 0,
        "recommendations": 0,
        "runtime_seconds": 0.006,
        "provides": [
          "entity_identity",
          "freshness",
          "corroboration"
        ]
      },
      {
        "skill": "engagement-audit",
        "version": "1.0.0",
        "status": "ok",
        "error": null,
        "findings": 0,
        "recommendations": 3,
        "runtime_seconds": 0.008,
        "provides": [
          "engagement"
        ]
      }
    ],
    "runtime_seconds": 11.054,
    "pages_fetched": 12,
    "broken_links": []
  }
}